{
  "$schema": "https://contextpassport.com/schema/v2.json",
  "schema_version": "2.0",
  "id": "ctx_1774359000000_d4e5f6a1b2c3",
  "parent_id": null,
  "trace_id": "trace_demo_research_brief",
  "branch_key": "main",
  "created_by": {
    "agent_id": "agent-auditor-01",
    "agent_name": "Audit Agent",
    "role": "auditor",
    "provider": "example",
    "model": "demo-agent-v1"
  },
  "event": {
    "type": "audit",
    "to_agent_id": null,
    "timestamp": "2026-03-29T11:00:00Z"
  },
  "payload": {
    "input": "Review launch summary chain for source-backed claims.",
    "output": {
      "status": "passed",
      "checked_contexts": [
        "ctx_1774358291000_a1b2c3d4e5f6",
        "ctx_1774358350000_b2c3d4e5f6a1",
        "ctx_1774358460000_c3d4e5f6a1b2"
      ]
    }
  },
  "integrity": {
    "payload_hash": "sha256:5c0f1239de654ec7231d7c1f29788ab31112bde0dbae55635e0d2cf4e9050246",
    "parent_hash": null,
    "integrity_hash": "sha256:023d12cccdb6611f57038dd2174765f362b3feace7fb8df2f0813b637493168a"
  },
  "created_at": "2026-03-29T11:00:00Z",
  "signature": {
    "algorithm": "ed25519",
    "key_id": "did:example:contextpassport#demo-key-1",
    "public_key": "LeBaZ8Bgmwex3N2vGFE/ot5fZxXl+sQ/WMtZxEh07rE=",
    "signature": "YA2cYGVFrNU1fr7SGeQbIwvZp4T0hpf3qT0ZZkEwG5sx7bqu0zP8cgPr4AOYUbKwXFelmdYXF02O+I2tiO+dAA=="
  }
}
