[
  {
    "$schema": "https://contextpassport.com/schema/v2.json",
    "schema_version": "2.0",
    "id": "ctx_1774358460000_c3d4e5f6a1b2",
    "parent_id": null,
    "trace_id": "trace_demo_research_brief",
    "branch_key": "main",
    "created_by": {
      "agent_id": "agent-reviewer-01",
      "agent_name": "Reviewer Agent",
      "role": "reviewer",
      "provider": "example",
      "model": "demo-agent-v1"
    },
    "event": {
      "type": "checkpoint",
      "to_agent_id": null,
      "timestamp": "2026-03-29T10:31:00Z"
    },
    "payload": {
      "input": {
        "draft": "Customer-facing launch summary prepared.",
        "open_questions": [
          "Confirm enterprise support SLA wording."
        ]
      },
      "output": {
        "decision": "approved_with_minor_edits",
        "notes": [
          "Remove unverifiable adoption metric.",
          "Keep pricing language source-backed."
        ]
      }
    },
    "integrity": {
      "payload_hash": "sha256:3eb2fcd7fa14ffc8b7bab54667ffdc68263da2e403ac0ddfe78065adb0f8b34f",
      "parent_hash": null,
      "integrity_hash": "sha256:5364f59ce76fd24f8c251000a85ee3d67da710fd9fa46895d1b926a3a8a7d7a1"
    },
    "created_at": "2026-03-29T10:31:00Z"
  },
  {
    "$schema": "https://contextpassport.com/schema/v2.json",
    "schema_version": "2.0",
    "id": "ctx_1774358480000_d1e2f3a4b5c6",
    "parent_id": "ctx_1774358460000_c3d4e5f6a1b2",
    "trace_id": "trace_demo_research_brief",
    "branch_key": "alt-pricing",
    "created_by": {
      "agent_id": "agent-planner-01",
      "agent_name": "Planner Agent",
      "role": "planner",
      "provider": "example",
      "model": "demo-agent-v1"
    },
    "event": {
      "type": "fork",
      "to_agent_id": null,
      "timestamp": "2026-03-29T10:33:00Z"
    },
    "payload": {
      "input": "Explore alternate enterprise pricing copy on a side branch.",
      "output": {
        "fork_from": "ctx_1774358460000_c3d4e5f6a1b2",
        "branch_key": "alt-pricing",
        "reason": "Test softer enterprise pricing language before merge."
      }
    },
    "integrity": {
      "payload_hash": "sha256:4a33009be77f1b0f163a8cf59d2a7961172ba4b7280848a5ede393267be60324",
      "parent_hash": "sha256:5364f59ce76fd24f8c251000a85ee3d67da710fd9fa46895d1b926a3a8a7d7a1",
      "integrity_hash": "sha256:6894224dc6dcbe421aa73fea808155db22f23f91ed36f8ce2553bf653be1ec53"
    },
    "created_at": "2026-03-29T10:33:00Z"
  }
]
