{
  "$schema": "https://contextpassport.com/schema/v2.json",
  "schema_version": "2.0",
  "id": "ctx_1774358330000_a1b2c3d4e5f7",
  "parent_id": null,
  "trace_id": "trace_demo_research_brief",
  "branch_key": "main",
  "created_by": {
    "agent_id": "agent-planner-01",
    "agent_name": "Planner Agent",
    "role": "planner",
    "provider": "example",
    "model": "demo-agent-v1"
  },
  "event": {
    "type": "spawn",
    "to_agent_id": "agent-writer-01",
    "timestamp": "2026-03-29T10:06:00Z"
  },
  "payload": {
    "input": {
      "summary": "Found release notes, pricing FAQ, and support article.",
      "confidence": 0.91,
      "sources": [
        "release-notes.md",
        "pricing-faq.md"
      ]
    },
    "output": {
      "handoff": "Write a customer-facing launch summary from the research brief."
    },
    "variables": {
      "tone": "customer_facing",
      "max_words": 600
    }
  },
  "integrity": {
    "payload_hash": "sha256:d94802bf53799d6617a0f2712ea555ce74d709f836617483c1d5510947c1b501",
    "parent_hash": null,
    "integrity_hash": "sha256:815f92fdc28ed28981b798476c8d76b0618b82380ae294b51227bdb8e0477d9c"
  },
  "created_at": "2026-03-29T10:06:00Z"
}
