[
  {
    "$schema": "https://contextpassport.com/schema/v2.json",
    "schema_version": "2.0",
    "id": "ctx_1774358350000_b2c3d4e5f6a1",
    "parent_id": null,
    "trace_id": "trace_demo_research_brief",
    "branch_key": "main",
    "created_by": {
      "agent_id": "agent-writer-01",
      "agent_name": "Writer Agent",
      "role": "writer",
      "provider": "example",
      "model": "demo-agent-v1"
    },
    "event": {
      "type": "commit",
      "to_agent_id": null,
      "timestamp": "2026-03-29T10:12:30Z"
    },
    "payload": {
      "input": "Draft customer-facing launch summary from research brief.",
      "output": {
        "draft": "Customer-facing launch summary prepared.",
        "open_questions": [
          "Confirm enterprise support SLA wording."
        ]
      }
    },
    "integrity": {
      "payload_hash": "sha256:60204ae61e367079befcecefb1e2c30e96c5eac0aaf39a1e012225455fb059a8",
      "parent_hash": null,
      "integrity_hash": "sha256:282bdc85e3ced5b9b5ac4ddc33d681811918a417bc2b69fce2f23748f47b4976"
    },
    "created_at": "2026-03-29T10:12:30Z"
  },
  {
    "$schema": "https://contextpassport.com/schema/v2.json",
    "schema_version": "2.0",
    "id": "ctx_1774358490000_e5f6a7b8c9da",
    "parent_id": "ctx_1774358350000_b2c3d4e5f6a1",
    "trace_id": "trace_demo_research_brief",
    "branch_key": "main",
    "created_by": {
      "agent_id": "agent-reviewer-01",
      "agent_name": "Reviewer Agent",
      "role": "reviewer",
      "provider": "example",
      "model": "demo-agent-v1"
    },
    "event": {
      "type": "revert",
      "to_agent_id": null,
      "timestamp": "2026-03-29T10:34:00Z"
    },
    "payload": {
      "input": "Reviewer flagged unverifiable adoption metric in the draft.",
      "output": {
        "reverted_record": "ctx_1774358350000_b2c3d4e5f6a1",
        "reason": "Draft included an adoption metric without a source citation.",
        "restored_to": "research_brief_only"
      }
    },
    "integrity": {
      "payload_hash": "sha256:d57d6ac2decd245e4d2757c85a4fc669863101f129faa12789118ea3c9c22ae0",
      "parent_hash": "sha256:282bdc85e3ced5b9b5ac4ddc33d681811918a417bc2b69fce2f23748f47b4976",
      "integrity_hash": "sha256:da1f660badc3692c0e97123d389764f14eced93c8fcc2e998f0536bc875edcd9"
    },
    "created_at": "2026-03-29T10:34:00Z"
  }
]
